{
  "schema_version": "1.0.0",
  "run_id": "09d01f5c-def7-4bca-a8bc-468bb17c7638",
  "run_started_at": "2026-04-17T00:22:35.901441+00:00",
  "run_finished_at": "2026-04-17T00:22:39.735456+00:00",
  "node": {
    "host": "openclaw",
    "os": "Linux 6.17.0-20-generic",
    "gpu": "NVIDIA GeForce RTX 5090",
    "vram_total_gb": 31.8427734375,
    "vram_free_gb_at_start": 0.8359375,
    "driver": "590.48.01",
    "cuda": "13.1",
    "shared_gpu": false,
    "cold_start": false
  },
  "service": {
    "repo": "unknown",
    "commit": "0000000",
    "protocol_doc": "uttera/uttera-infra:benchmarks/PROTOCOL.md",
    "model": "openai/whisper-large-v3-turbo",
    "engine": "vllm",
    "config": {
      "max_num_seqs": 64,
      "max_model_len": 448,
      "gpu_memory_utilization": 0.9
    }
  },
  "corpus": {
    "id": "librispeech-test-clean",
    "n_clips": 2620,
    "total_audio_seconds": 19452.480625,
    "sha256_manifest": "18dbc9a7e507b5ea64f468dae9742e18ccdb722da18b81618db418041c98ca36",
    "clip_duration_mean": 7.4246109255725194,
    "clip_duration_min": 1.285,
    "clip_duration_max": 34.955
  },
  "profile": {
    "kind": "burst",
    "n": 64,
    "warmup": 3
  },
  "command": "./bench.py --mode stt --server http://127.0.0.1:5002 --profile burst --n 64 --corpus ./corpora/librispeech-test-clean --output /home/claw/.openclaw/agents/main/workspace/projects/coding/uttera-benchmarks/results/2026-04-17-run2b-vllm-dedicated/vllm-burst64.json",
  "raw_csv_path": "vllm-burst64.csv",
  "metrics": {
    "wall_s": 3.834001064300537,
    "ok": 64,
    "fail": 0,
    "rps": 16.692744453287197,
    "rtf_agg": 125.99373784684327,
    "latency_ms": {
      "min": 1571.2542533874512,
      "p50": 3140.4316425323486,
      "p90": 3542.7238941192627,
      "p95": 3550.81844329834,
      "p99": 3561.6135597229004,
      "max": 3561.6135597229004,
      "avg": 2995.7618080079556
    },
    "routes": {
      "-": 64
    }
  }
}