{
  "schema_version": "1.0.0",
  "run_id": "b53440ca-4360-4acd-bca9-34a86c6c744a",
  "run_started_at": "2026-04-18T01:25:32.318864+00:00",
  "run_finished_at": "2026-04-18T01:38:00.685596+00:00",
  "node": {
    "host": "openclaw",
    "os": "Linux 6.17.0-20-generic",
    "gpu": "NVIDIA GeForce RTX 5090",
    "vram_total_gb": 31.8427734375,
    "vram_free_gb_at_start": 6.0078125,
    "driver": "590.48.01",
    "cuda": "13.1",
    "shared_gpu": false,
    "cold_start": false
  },
  "service": {
    "repo": "uttera/uttera-tts-hotcold",
    "commit": "c8d33a93e48edf79fa04bd1cc5067f49a3ae3257",
    "tag": "v2.1.0",
    "protocol_doc": "uttera/uttera-benchmarks:PROTOCOL.md",
    "model": "openbmb/VoxCPM2",
    "engine": "voxcpm (hot/cold subprocess pool, v2.1.0)",
    "config": {
      "TTS_BACKEND": "voxcpm",
      "COLD_POOL_SIZE": 2,
      "COLD_VRAM_HEADROOM_GB": 3.0,
      "CACHE_TTL_MINUTES": 0
    }
  },
  "corpus": {
    "id": "uttera-tts-40w",
    "n_clips": 40,
    "total_audio_seconds": 0.0,
    "sha256_manifest": "d7322718382eca7cfd7a4c1e1697b969cba78165f6f2b3d68cc5d1a3ca688b53"
  },
  "profile": {
    "kind": "burst",
    "n": 256,
    "warmup": 3
  },
  "command": "bench.py --mode tts --server http://127.0.0.1:5101 --profile burst --n 256 --corpus ./corpora/uttera-tts-40w --client-timeout 3600 --output /tmp/exp-voxcpm-nocg-256.json",
  "raw_csv_path": "exp-voxcpm-nocg-256.csv",
  "metrics": {
    "wall_s": 748.3667209148407,
    "ok": 244,
    "fail": 12,
    "rps": 0.32604335973374426,
    "rtf_agg": 0.0,
    "latency_ms": {
      "min": 1977.0445823669434,
      "p50": 374612.07246780396,
      "p90": 670647.4063396454,
      "p95": 702796.7607975006,
      "p99": 736841.8309688568,
      "max": 739212.662935257,
      "avg": 376808.0950867934
    },
    "routes": {
      "HOT": 88,
      "COLD-POOL": 156
    }
  }
}