{
  "schema_version": "1.0.0",
  "run_id": "942ada60-74fd-4f2b-8843-3416094bd827",
  "run_started_at": "2026-04-17T01:14:18.789008+00:00",
  "run_finished_at": "2026-04-17T01:14:30.482810+00:00",
  "node": {
    "host": "node-a",
    "os": "Linux 6.17.0-20-generic",
    "gpu": "NVIDIA GeForce RTX 5090",
    "vram_total_gb": 31.8427734375,
    "vram_free_gb_at_start": 23.0869140625,
    "driver": "590.48.01",
    "cuda": "13.1",
    "shared_gpu": false,
    "cold_start": false
  },
  "service": {
    "repo": "unknown",
    "commit": "0000000",
    "protocol_doc": "uttera/uttera-infra:benchmarks/PROTOCOL.md",
    "model": "turbo",
    "engine": "unknown",
    "config": {}
  },
  "corpus": {
    "id": "uttera-stt-internal",
    "n_clips": 160,
    "total_audio_seconds": 3065.4431875,
    "sha256_manifest": "34d7c5af847f4817a82eee06e078f83b23a4872cf4efd47fb21157571e06496f",
    "clip_duration_mean": 19.159019921875,
    "clip_duration_min": 13.323375,
    "clip_duration_max": 27.435375
  },
  "profile": {
    "kind": "burst",
    "n": 64,
    "warmup": 3
  },
  "command": "./bench.py --mode stt --server http://stt-node:5000 --profile burst --n 64 --corpus ./corpora/uttera-stt-internal --output ./results/2026-04-17-run3-hotcold-internal/hotcold-burst64.json",
  "raw_csv_path": "hotcold-burst64.csv",
  "metrics": {
    "wall_s": 11.693790435791016,
    "ok": 64,
    "fail": 0,
    "rps": 5.472990161010251,
    "rtf_agg": 107.38246139221657,
    "latency_ms": {
      "min": 195.72138786315918,
      "p50": 6051.023721694946,
      "p90": 10266.462326049805,
      "p95": 10793.044567108154,
      "p99": 11106.422901153564,
      "max": 11106.422901153564,
      "avg": 5862.866371870041
    },
    "routes": {
      "HOT": 54,
      "COLD-POOL": 10
    }
  }
}