{
  "schema_version": "1.0.0",
  "run_id": "54001c90-db6e-492a-8df7-d8504a626053",
  "run_started_at": "2026-04-17T19:13:39.233703+00:00",
  "run_finished_at": "2026-04-17T19:14:59.715598+00:00",
  "node": {
    "host": "openclaw",
    "os": "Linux 6.17.0-20-generic",
    "gpu": "NVIDIA GeForce RTX 5090",
    "vram_total_gb": 31.8427734375,
    "vram_free_gb_at_start": 15.48828125,
    "driver": "590.48.01",
    "cuda": "13.1",
    "shared_gpu": false,
    "cold_start": false
  },
  "service": {
    "repo": "unknown",
    "commit": "0000000",
    "protocol_doc": "uttera/uttera-infra:benchmarks/PROTOCOL.md",
    "model": "tts_models/multilingual/multi-dataset/xtts_v2",
    "engine": "unknown",
    "config": {}
  },
  "corpus": {
    "id": "uttera-tts-40w",
    "n_clips": 40,
    "total_audio_seconds": 0.0,
    "sha256_manifest": "d7322718382eca7cfd7a4c1e1697b969cba78165f6f2b3d68cc5d1a3ca688b53"
  },
  "profile": {
    "kind": "latency",
    "iterations": 20,
    "warmup": 3
  },
  "command": "bench.py --mode tts --server http://127.0.0.1:5101 --profile latency --corpus ./corpora/uttera-tts-40w --output ./results/run7-tts-hotcold-voxcpm/voxcpm-latency.json",
  "raw_csv_path": "voxcpm-latency.csv",
  "metrics": {
    "wall_s": 80.48188519477844,
    "ok": 20,
    "fail": 0,
    "rps": 0.2485031252883422,
    "rtf_agg": 0.0,
    "latency_ms": {
      "min": 1592.0991897583008,
      "p50": 3527.1661281585693,
      "p90": 4038.785219192505,
      "p95": 10742.485523223877,
      "p99": 10742.485523223877,
      "max": 10742.485523223877,
      "avg": 3644.3016409873962
    },
    "routes": {
      "HOT": 11,
      "COLD-POOL": 9
    }
  }
}