{
  "schema_version": "1.0.0",
  "run_id": "47217547-b08e-49fc-969b-002e876d00bb",
  "run_started_at": "2026-04-17T13:46:22.549559+00:00",
  "run_finished_at": "2026-04-17T13:51:29.567445+00:00",
  "node": {
    "host": "openclaw",
    "os": "Linux 6.17.0-20-generic",
    "gpu": "NVIDIA GeForce RTX 5090",
    "vram_total_gb": 31.8427734375,
    "vram_free_gb_at_start": 4.453125,
    "driver": "590.48.01",
    "cuda": "13.1",
    "shared_gpu": false,
    "cold_start": false
  },
  "service": {
    "repo": "unknown",
    "commit": "0000000",
    "protocol_doc": "uttera/uttera-infra:benchmarks/PROTOCOL.md",
    "model": "openbmb/VoxCPM2",
    "engine": "nano-vllm-voxcpm",
    "config": {
      "max_num_seqs": 32,
      "max_model_len": 4096,
      "gpu_memory_utilization": 0.85
    }
  },
  "corpus": {
    "id": "uttera-tts-40w",
    "n_clips": 40,
    "total_audio_seconds": 0.0,
    "sha256_manifest": "d7322718382eca7cfd7a4c1e1697b969cba78165f6f2b3d68cc5d1a3ca688b53"
  },
  "profile": {
    "kind": "sustained",
    "rps": 2.0,
    "duration_s": 300,
    "warmup": 3
  },
  "command": "bench.py --mode tts --server http://127.0.0.1:5100 --profile sustained --rps 2 --duration 300 --corpus ./corpora/uttera-tts-40w --output ./results/run6-tts-vllm/vllm-sustained.json",
  "raw_csv_path": "vllm-sustained.csv",
  "metrics": {
    "wall_s": 307.01787638664246,
    "ok": 600,
    "fail": 0,
    "rps": 1.9542835976247552,
    "rtf_agg": 0.0,
    "latency_ms": {
      "min": 2020.538330078125,
      "p50": 3253.322124481201,
      "p90": 3847.545862197876,
      "p95": 4034.6922874450684,
      "p99": 4413.501977920532,
      "max": 4753.8721561431885,
      "avg": 3195.2817018826804
    },
    "routes": {
      "HOT": 600
    },
    "sustained_p95_drift": [
      3939.1913414001465,
      4032.494068145752,
      4348.915100097656,
      3952.1868228912354,
      4210.808038711548,
      3679.495096206665
    ]
  }
}