{
  "schema_version": "1.0.0",
  "run_id": "76d1181d-b163-40ed-bd85-991fa82d29f5",
  "run_started_at": "2026-04-16T23:51:07.787785+00:00",
  "run_finished_at": "2026-04-16T23:52:00.291950+00:00",
  "node": {
    "host": "openclaw",
    "os": "Linux 6.17.0-20-generic",
    "gpu": "NVIDIA GeForce RTX 5090",
    "vram_total_gb": 31.8427734375,
    "vram_free_gb_at_start": 18.2890625,
    "driver": "590.48.01",
    "cuda": "13.1",
    "shared_gpu": false,
    "cold_start": false
  },
  "service": {
    "repo": "unknown",
    "commit": "0000000",
    "protocol_doc": "uttera/uttera-infra:benchmarks/PROTOCOL.md",
    "model": "turbo",
    "engine": "unknown",
    "config": {}
  },
  "corpus": {
    "id": "librispeech-test-clean",
    "n_clips": 2620,
    "total_audio_seconds": 19452.480625,
    "sha256_manifest": "18dbc9a7e507b5ea64f468dae9742e18ccdb722da18b81618db418041c98ca36",
    "clip_duration_mean": 7.4246109255725194,
    "clip_duration_min": 1.285,
    "clip_duration_max": 34.955
  },
  "profile": {
    "kind": "burst",
    "n": 512,
    "warmup": 3
  },
  "command": "./bench.py --mode stt --server http://sphinx:5000 --profile burst --n 512 --corpus ./corpora/librispeech-test-clean --output results/hotcold-burst512.json",
  "raw_csv_path": "hotcold-burst512.csv",
  "metrics": {
    "wall_s": 52.50415086746216,
    "ok": 512,
    "fail": 0,
    "rps": 9.75160994970583,
    "rtf_agg": 74.30346335565012,
    "latency_ms": {
      "min": 210.67547798156738,
      "p50": 24773.78511428833,
      "p90": 46808.30669403076,
      "p95": 49078.0291557312,
      "p99": 51164.80493545532,
      "max": 51917.09208488464,
      "avg": 25536.132308188826
    },
    "routes": {
      "COLD-POOL": 254,
      "HOT": 258
    }
  }
}