{
  "schema_version": "1.0.0",
  "run_id": "2b7dd76a-a863-4bdc-b061-2326f9030f05",
  "run_started_at": "2026-04-17T00:22:32.126942+00:00",
  "run_finished_at": "2026-04-17T00:22:34.191247+00:00",
  "node": {
    "host": "node-a",
    "os": "Linux 6.17.0-20-generic",
    "gpu": "NVIDIA GeForce RTX 5090",
    "vram_total_gb": 31.8427734375,
    "vram_free_gb_at_start": 0.8359375,
    "driver": "590.48.01",
    "cuda": "13.1",
    "shared_gpu": false,
    "cold_start": false
  },
  "service": {
    "repo": "unknown",
    "commit": "0000000",
    "protocol_doc": "uttera/uttera-infra:benchmarks/PROTOCOL.md",
    "model": "openai/whisper-large-v3-turbo",
    "engine": "vllm",
    "config": {
      "max_num_seqs": 64,
      "max_model_len": 448,
      "gpu_memory_utilization": 0.9
    }
  },
  "corpus": {
    "id": "librispeech-test-clean",
    "n_clips": 2620,
    "total_audio_seconds": 19452.480625,
    "sha256_manifest": "18dbc9a7e507b5ea64f468dae9742e18ccdb722da18b81618db418041c98ca36",
    "clip_duration_mean": 7.4246109255725194,
    "clip_duration_min": 1.285,
    "clip_duration_max": 34.955
  },
  "profile": {
    "kind": "latency",
    "iterations": 20,
    "warmup": 3
  },
  "command": "./bench.py --mode stt --server http://127.0.0.1:5002 --profile latency --corpus ./corpora/librispeech-test-clean --output ./results/2026-04-17-run2-vllm-librispeech/vllm-latency.json",
  "raw_csv_path": "vllm-latency.csv",
  "metrics": {
    "wall_s": 2.0642902851104736,
    "ok": 20,
    "fail": 0,
    "rps": 9.68855986207854,
    "rtf_agg": 75.79847835772102,
    "latency_ms": {
      "min": 67.05427169799805,
      "p50": 82.27324485778809,
      "p90": 100.13270378112793,
      "p95": 104.04348373413086,
      "p99": 104.04348373413086,
      "max": 104.04348373413086,
      "avg": 83.00994634628296
    },
    "routes": {
      "-": 20
    },
    "rtf_single_mean": 91.15266275387668
  }
}