{
  "schema_version": "1.0.0",
  "run_id": "6d91d54f-acfb-4ec5-a863-79cc6f090cc9",
  "run_started_at": "2026-04-17T01:16:37.276094+00:00",
  "run_finished_at": "2026-04-17T01:16:58.330557+00:00",
  "node": {
    "host": "openclaw",
    "os": "Linux 6.17.0-20-generic",
    "gpu": "NVIDIA GeForce RTX 5090",
    "vram_total_gb": 31.8427734375,
    "vram_free_gb_at_start": 9.2431640625,
    "driver": "590.48.01",
    "cuda": "13.1",
    "shared_gpu": false,
    "cold_start": false
  },
  "service": {
    "repo": "unknown",
    "commit": "0000000",
    "protocol_doc": "uttera/uttera-infra:benchmarks/PROTOCOL.md",
    "model": "turbo",
    "engine": "unknown",
    "config": {}
  },
  "corpus": {
    "id": "uttera-stt-internal",
    "n_clips": 160,
    "total_audio_seconds": 3065.4431875,
    "sha256_manifest": "34d7c5af847f4817a82eee06e078f83b23a4872cf4efd47fb21157571e06496f",
    "clip_duration_mean": 19.159019921875,
    "clip_duration_min": 13.323375,
    "clip_duration_max": 27.435375
  },
  "profile": {
    "kind": "burst",
    "n": 1024,
    "warmup": 3
  },
  "command": "./bench.py --mode stt --server http://sphinx:5000 --profile burst --n 1024 --corpus ./corpora/uttera-stt-internal --output /home/claw/.openclaw/agents/main/workspace/projects/coding/uttera-benchmarks/results/2026-04-17-run3-hotcold-internal/hotcold-burst1024.json",
  "raw_csv_path": "hotcold-burst1024.csv",
  "metrics": {
    "wall_s": 21.05444884300232,
    "ok": 101,
    "fail": 923,
    "rps": 4.797085915339383,
    "rtf_agg": 90.87725719003706,
    "latency_ms": {
      "min": 433.13097953796387,
      "p50": 8759.20295715332,
      "p90": 19537.68563270569,
      "p95": 19600.838661193848,
      "p99": 20303.738594055176,
      "max": 20307.161808013916,
      "avg": 10404.640370076246
    },
    "routes": {
      "COLD-POOL": 71,
      "HOT": 30
    }
  }
}