{
  "schema_version": "1.0.0",
  "run_id": "730deff2-25fd-403b-93b1-db4c21dc32bf",
  "run_started_at": "2026-04-16T23:50:23.622291+00:00",
  "run_finished_at": "2026-04-16T23:50:26.573405+00:00",
  "node": {
    "host": "node-a",
    "os": "Linux 6.17.0-20-generic",
    "gpu": "NVIDIA GeForce RTX 5090",
    "vram_total_gb": 31.8427734375,
    "vram_free_gb_at_start": 25.2578125,
    "driver": "590.48.01",
    "cuda": "13.1",
    "shared_gpu": false,
    "cold_start": false
  },
  "service": {
    "repo": "unknown",
    "commit": "0000000",
    "protocol_doc": "uttera/uttera-infra:benchmarks/PROTOCOL.md",
    "model": "turbo",
    "engine": "unknown",
    "config": {}
  },
  "corpus": {
    "id": "librispeech-test-clean",
    "n_clips": 2620,
    "total_audio_seconds": 19452.480625,
    "sha256_manifest": "18dbc9a7e507b5ea64f468dae9742e18ccdb722da18b81618db418041c98ca36",
    "clip_duration_mean": 7.4246109255725194,
    "clip_duration_min": 1.285,
    "clip_duration_max": 34.955
  },
  "profile": {
    "kind": "latency",
    "iterations": 20,
    "warmup": 3
  },
  "command": "./bench.py --mode stt --server http://stt-node:5000 --profile latency --corpus ./corpora/librispeech-test-clean --output results/hotcold-latency.json",
  "raw_csv_path": "hotcold-latency.csv",
  "metrics": {
    "wall_s": 2.9510955810546875,
    "ok": 20,
    "fail": 0,
    "rps": 6.777144098075004,
    "rtf_agg": 53.0210080298651,
    "latency_ms": {
      "min": 98.40703010559082,
      "p50": 123.92997741699219,
      "p90": 142.87376403808594,
      "p95": 157.1340560913086,
      "p99": 157.1340560913086,
      "max": 157.1340560913086,
      "avg": 120.75203657150269
    },
    "routes": {
      "HOT": 20
    },
    "rtf_single_mean": 62.1329453411289
  }
}