{
  "schema_version": "1.0.0",
  "run_id": "228b6f23-6f9d-4557-915e-c399a580141a",
  "run_started_at": "2026-04-17T01:14:12.119677+00:00",
  "run_finished_at": "2026-04-17T01:14:16.332775+00:00",
  "node": {
    "host": "openclaw",
    "os": "Linux 6.17.0-20-generic",
    "gpu": "NVIDIA GeForce RTX 5090",
    "vram_total_gb": 31.8427734375,
    "vram_free_gb_at_start": 25.4375,
    "driver": "590.48.01",
    "cuda": "13.1",
    "shared_gpu": false,
    "cold_start": false
  },
  "service": {
    "repo": "unknown",
    "commit": "0000000",
    "protocol_doc": "uttera/uttera-infra:benchmarks/PROTOCOL.md",
    "model": "turbo",
    "engine": "unknown",
    "config": {}
  },
  "corpus": {
    "id": "uttera-stt-internal",
    "n_clips": 160,
    "total_audio_seconds": 3065.4431875,
    "sha256_manifest": "34d7c5af847f4817a82eee06e078f83b23a4872cf4efd47fb21157571e06496f",
    "clip_duration_mean": 19.159019921875,
    "clip_duration_min": 13.323375,
    "clip_duration_max": 27.435375
  },
  "profile": {
    "kind": "latency",
    "iterations": 20,
    "warmup": 3
  },
  "command": "./bench.py --mode stt --server http://sphinx:5000 --profile latency --corpus ./corpora/uttera-stt-internal --output /home/claw/.openclaw/agents/main/workspace/projects/coding/uttera-benchmarks/results/2026-04-17-run3-hotcold-internal/hotcold-latency.json",
  "raw_csv_path": "hotcold-latency.csv",
  "metrics": {
    "wall_s": 4.213083267211914,
    "ok": 20,
    "fail": 0,
    "rps": 4.747117189837876,
    "rtf_agg": 100.13579384562868,
    "latency_ms": {
      "min": 167.70100593566895,
      "p50": 183.22348594665527,
      "p90": 193.54820251464844,
      "p95": 197.69048690795898,
      "p99": 197.69048690795898,
      "max": 197.69048690795898,
      "avg": 181.255042552948
    },
    "routes": {
      "HOT": 20
    },
    "rtf_single_mean": 116.42166475249196
  }
}